id,name,lobby1,lobby2,lobby3,lobby4,lobby5,win,defeat,get
50,율리아나,아. 왔나? 벌써 시간이 이렇게 됐군.,리트라이는 적당히 하게나. 자네들이 시계를 돌릴 때마다 내 마력이 빠져나간단 말일세.,뭐? 하. 난 단 걸 좋아하지 않는다네. ... 그렇다고 준다는 걸 거절하겠다는 말은 아니었네만!,상담하고 싶은 게 있다면 언제든 찾아오게나. 자네라면 기꺼이 모래알처럼 쌓인 내 지혜를 빌려줄 테니.,시간은 언제나 부족한 법일세. 설사 무한의 시간이 있다 한들... 그것이 무한한 기회까지 보장하진 않는 법이지.,뭐. 그럭저럭 잘됐군 그래. 당이 좀 떨어지는데 초콜릿 남은 거 있나? 딱히 먹고 싶은 건 아니고.,요한. 너... 뭐하다 이제야...! 아. 아아....,지금 시간을 어디에 기록해두게나. 첫만남이란 언제나 귀중한 법이니.
51,한서린,취미... 말입니까? 부족한 실력이지만 요리를 조금.,제 걱정은 하지 마십쇼. 어차피... 재생 능력자이니.,...오빠...,키링 말입니까? ...귀엽지 않습니까.,모두를 구하기 위해... 존재에 대해 속죄하기 위해.,승리했습니다. 본부로 귀환하겠습니다.,죄... 죄송합니다... 쿨럭.,여명 길드 토벌과 4팀 한서린. 임무 수행을 위해 도착했습니다.
52,진천휘,소인과 검을 겨뤄보고 싶다고? 언제든 환영이오!,검밖에 모른다는 오해를 가끔 받소. 잠잘 때 말고는 검 생각만 하는 것뿐인데 말이오. 무인이라면 보통 그렇지 않소?,천마의 검술... 다시 볼 수 있으면 좋겠구려.,검? 방금 검이라고 했소? 아. 잘못 들은 거라고...,더 할 말이 없으면 이만 연무장으로 가봐도 되겠소? 오늘자 훈련을 해야 해서 말이오.,오늘도 검극에 한 발짝 더 가까워졌구려!,...이 패배 또한 성장의 양분이 될 것이오.,여명 길드 토벌과 4팀 진천휘라고 하오. 자아. 한 수 겨뤄보도록 하시겠소?
53,솔음,냐하하... 많은 걸 궁금해하지 않는 게 좋다고~?,솔음이는 말이지~? 꽃밭에 드러누워 낮잠을 자는 걸 좋아해~! 에헤헤...,솔음이는 위대한 대왕님을 모시지~! 그분의 결정이 곧 솔음이의 결정이라는 거야~!,영혼은 어디로 가서 어디로 사라지는 걸까...? 으음. 조금 무거운 이야기였나~?,사랑하는 사람을 지키기 위해 세계를 부수는 일에 대해서 어떻게 생각해~? 으응~?,이번에도~! 솔음이가 대활약했네~?,일단은 말이지~? 솔음이 잘못은 아니라고~?,냐하하~! 이것도 전부 대왕님의 인도라는 거야~!
54,엘리아스,엘리아스에게 볼일이라도 있나? 없다면 업무에 집중하겠다.,검은 쪽 권총이 레퀴엠. 흰 쪽이 키리에다. 특정해 명령을 내릴 것이라면 기억해두는 것이 좋을 것이다.,그것에 대해서는 망각했다. 엘리아스가 재고 없이 탄환으로 써버릴 정도로 가치가 없는 기억이었다는 뜻이니 신경쓰지 않는 편이 낫다.,아스트리드의 요청에 따라 금일 석식은 외식을 해야 하므로 정시에 퇴근하도록 하겠다.,미소를 지으라는 명령을 이행했을 뿐이다만... 어째서 이성 판정을 시행하는지 이해할 수 없군.,승리를 명령받아 그대로 수행했을 뿐이다. 놀랄 것도 칭찬을 할 것도 없다.,명령대로 이행하지 못했다. ,여명 길드 토벌과 4팀 소속 엘리아스 라르센. 명령을 하달받았다.
55,아스카,뚝딱뚝딱… 뭐야! 아스카 바빠! 말걸지마!,브에에에…..(침 흘리는 중),신지! 내가 말걸때 말고 대답하지 말랬지!?,엄마…. 빨리 일어났으면 좋겠다.,아빠….는 어디에 있는걸까?,엣헴~ 이 아스카님이 있으니까 당연한 결과야!,히이잉….,여명길드 소속 마이스터 아스카야!
56,아그네스,... 저는 아그네스입니다...?,이 옷은 제식 복장입니다. 비루한 맵시가 드러나는 건 조금 부끄럽긴 합니다만... 이 또한 신의 뜻일 테니.,빛은 필연적으로 그림자를 동반하는 법이니. 앞에 놓인 어둠을 신의 광휘가 네 등 뒤에 역사하심의 증거로 삼고. 의심을 짓밟으며 나아가라.,절제도 고행도... 힘들지 않다면 거짓이겠지요. 그렇기에 이따금 생기는 일상을 더욱 여유로이 활용하고 싶습니다. ... 어울려 주시겠습니까?,꺗. 버. 벌레가. ... 갑자기 나와서 놀랐을 뿐입니다.,인도해주시기를. 신의 검이 다음으로 휘둘러질 곳은 어디인지요.,검이 꺾이더라도... 제 믿음까지 꺾이진 않습니다...!,아그네스입니다. 그대의 정의는... 어디로 뻗어나가는지요.
57,아미나,살금... 살금... 아. 제가 보여요? 암습 연습 중이었는데! ,어두운 데에는 들어가지 말죠 저희. 절대 암시야 없어서 이러는 거 아니에요. 아니라니까요!,까무잡잡한 건 어릴 때 밖에서 너무 뛰어놀아서 그런 거예요. 실장님이 제 사고 수습해주시느라 고생깨나 하셨죠. 우헤헤.,전 위대한 에일랜드 가문의 숨겨진 딸이 틀림없어요. 꿈 깨라구요? 그건 두고봐야 아는 거죠!,이렇게!!!! 컬러 스프레... 아. 벨리사? 아무것도 아니야. 응.,이번 암습이 엄청 잘 들어간 덕분이에요! 이 낭만에 로그 한다 진짜.,죄송해요. 제가 제때 성공하지 못해서... 버리지 말아줘요. 제발. 전 아직 쓸모가...!,안녕하세요! 지명 감사합니다. 아미나입니다! ...이게 아니라구요?
58,엘모 4세,나는 엘모다!!!!!,데굴데굴데굴데굴,꿍싯꿍식,돈 좀 달라!!!!!!!,맛있는걸 달라!!!!!!!!!,엘모 이겼다!!!!!!!,엘모 졌다…?!!!!!!!,여긴 어디고 나는 엘모다!!!!!!!
59,엘리시아,...나는 복수다.,내 발 밑에 조아려보지 그래? 지배당한다는 거... 사실 기분 좋을 수도 있잖아?,이 고철... 말만 더럽게 많고. 쓸모라곤 전혀 없어.,베른하르트가 보고 싶은걸...,어렸을 때 철없는 꿈을 꾼 적이 있었어. 너는 그렇게 되지 않기를.,나... 승리. 이번 의뢰도 무사히 완수인가?,...아빠..... 나 아파...,반가워. 나는 엘리시아. 네가 나의 의뢰주?
60,다이애나,흐흥~ 이 다이애나 님과 시간을 보내고 싶은거야?,자아 자아! 어서 날 더 찬양하라고!,왜 유독 내 주문만 자주 빗나가는 것 같지?!,나... 나는 대마법사라고! 왜 안 믿는거야!,어이 열등종. 어서 내 시중을 들도록 해.,꺄하하하! 대마법사 다이애나님의 대활약이었네!,이... 이이이이이익!! 다 너 때문이야!,나는 루센델의 레이디 다이애나! 모두 엎드려 경배하도록!